{
	"$schema": "https://json-schema.org/draft/2020-12/schema",
	"$id": "https://github.com/noexcs/pi/packages/ace-runtime/schema/ace-config.schema.json",
	"title": "ACE runtime configuration (.ace.json)",
	"description": "Which channels this agent subscribes to and publishes on (RFC §10). Every MQ setting lives here; ACE messages never carry it (RFC §4).",
	"type": "object",
	"required": [
		"subscribe"
	],
	"properties": {
		"sender": {
			"type": "string",
			"pattern": "^[A-Za-z0-9._@:-]{1,128}$",
			"description": "Sender identifier this session publishes under (RFC §5.3); required once publish channels exist."
		},
		"defaultActivation": {
			"type": "string",
			"enum": [
				"immediate",
				"next_turn",
				"manual"
			],
			"description": "Fallback activation when neither the subscription nor the message decides (RFC §8)."
		},
		"subscribe": {
			"type": "array",
			"minItems": 1,
			"description": "Channels this agent receives ACE events from.",
			"items": {
				"$ref": "#/$defs/subscribe"
			}
		},
		"publish": {
			"type": "array",
			"minItems": 1,
			"description": "Channels the ace_publish tool may send ACE events to (RFC §19).",
			"items": {
				"$ref": "#/$defs/publish"
			}
		},
		"manual": {
			"type": "object",
			"description": "Retention limits for manual events (defaults: 100 events, 24h).",
			"properties": {
				"max": {
					"type": "integer",
					"minimum": 1
				},
				"ttlMs": {
					"type": "integer",
					"minimum": 1
				}
			},
			"additionalProperties": false
		},
		"spool": {
			"type": "object",
			"description": "Where burst files go; thresholds live on each subscription.",
			"required": [
				"dir"
			],
			"properties": {
				"dir": {
					"type": "string",
					"minLength": 1
				},
				"retentionMs": {
					"type": "integer",
					"minimum": 1
				},
				"maxFiles": {
					"type": "integer",
					"minimum": 1
				}
			},
			"additionalProperties": false
		},
		"registry": {
			"type": "object",
			"description": "Agent directory this session registers itself in (RFC §22 item 1); omitted means no registration.",
			"required": [
				"url"
			],
			"properties": {
				"url": {
					"type": "string",
					"minLength": 1,
					"description": "Broker URL of the directory, e.g. redis://127.0.0.1:6379."
				},
				"prefix": {
					"type": "string",
					"minLength": 1,
					"description": "Key namespace, default ace:agents."
				}
			},
			"additionalProperties": false
		}
	},
	"allOf": [
		{
			"if": {
				"required": [
					"publish"
				]
			},
			"then": {
				"required": [
					"sender"
				]
			}
		}
	],
	"additionalProperties": false,
	"$defs": {
		"channel": {
			"type": "object",
			"required": [
				"name",
				"transport"
			],
			"properties": {
				"name": {
					"type": "string",
					"minLength": 1,
					"description": "Channel name: the key its transport is registered under, and the tool's target."
				},
				"transport": {
					"type": "string",
					"enum": [
						"redis-streams"
					],
					"description": "Transport kind; the settings below live in `config`."
				},
				"description": {
					"type": "string",
					"minLength": 1,
					"description": "Who or what sits on the other end; shown to the model in the ace_publish tool description."
				},
				"enabled": {
					"type": "boolean",
					"description": "Set false to keep the channel configured but not started."
				},
				"config": {
					"type": "object",
					"description": "Transport-specific settings, validated against the kind.",
					"additionalProperties": true
				},
				"options": {
					"type": "object",
					"description": "Raw options passed through to the transport's client library; not validated.",
					"additionalProperties": true
				},
				"activation": {
					"type": "string",
					"enum": [
						"immediate",
						"next_turn",
						"manual",
						"default"
					],
					"description": "Subscribe only: receiver override for this channel (RFC §8); default delegates to the message."
				},
				"allowedSenders": {
					"type": "array",
					"minItems": 1,
					"description": "Subscribe only: glob patterns of accepted senders (e.g. ci:*, agent-*); omit to accept any.",
					"items": {
						"type": "string",
						"minLength": 1
					}
				},
				"spool": {
					"type": "object",
					"description": "Subscribe only: spill bursts to a file beyond these thresholds.",
					"required": [
						"afterEvents",
						"windowMs"
					],
					"properties": {
						"afterEvents": {
							"type": "integer",
							"minimum": 1
						},
						"windowMs": {
							"type": "integer",
							"minimum": 1
						}
					},
					"additionalProperties": false
				}
			},
			"additionalProperties": false
		},
		"redisStreamsPublish": {
			"type": "object",
			"description": "Append-only target: the publisher needs an address and a field, nothing to read.",
			"properties": {
				"stream": {
					"type": "string",
					"minLength": 1,
					"description": "Stream to append to."
				},
				"url": {
					"type": "string",
					"minLength": 1,
					"description": "Broker URL, default redis://127.0.0.1:6379."
				},
				"field": {
					"type": "string",
					"minLength": 1,
					"description": "Entry field carrying the ACE JSON, default message."
				}
			},
			"additionalProperties": false,
			"required": [
				"stream"
			]
		},
		"redisStreamsSubscribe": {
			"type": "object",
			"properties": {
				"stream": {
					"type": "string",
					"minLength": 1
				},
				"group": {
					"type": "string",
					"minLength": 1
				},
				"url": {
					"type": "string",
					"minLength": 1
				},
				"consumer": {
					"type": "string",
					"minLength": 1
				},
				"field": {
					"type": "string",
					"minLength": 1
				},
				"count": {
					"type": "integer",
					"minimum": 1
				},
				"blockMs": {
					"type": "integer",
					"minimum": 1,
					"description": "Block window per read, default 1000."
				},
				"reclaimIdleMs": {
					"type": "integer",
					"minimum": 0,
					"description": "Claim entries another consumer left pending this long; 0 disables reclaiming. Default 60000."
				},
				"reclaimAttempts": {
					"type": "integer",
					"minimum": 1,
					"description": "Give up on a reclaimed entry after this many deliveries. Default 3."
				},
				"retryDelayMs": {
					"type": "integer",
					"minimum": 1,
					"description": "First reconnect delay after a read failure; doubles up to maxRetryDelayMs. Default 200."
				},
				"maxRetryDelayMs": {
					"type": "integer",
					"minimum": 1,
					"description": "Cap for the reconnect delay. Default 5000."
				}
			},
			"additionalProperties": false,
			"required": [
				"stream",
				"group"
			]
		},
		"subscribe": {
			"allOf": [
				{
					"$ref": "#/$defs/channel"
				},
				{
					"if": {
						"properties": {
							"transport": {
								"const": "redis-streams"
							}
						},
						"required": [
							"transport"
						]
					},
					"then": {
						"properties": {
							"config": {
								"$ref": "#/$defs/redisStreamsSubscribe"
							}
						}
					}
				}
			]
		},
		"publish": {
			"allOf": [
				{
					"$ref": "#/$defs/channel"
				},
				{
					"not": {
						"required": [
							"activation"
						]
					}
				},
				{
					"not": {
						"required": [
							"allowedSenders"
						]
					}
				},
				{
					"not": {
						"required": [
							"spool"
						]
					}
				},
				{
					"if": {
						"properties": {
							"transport": {
								"const": "redis-streams"
							}
						},
						"required": [
							"transport"
						]
					},
					"then": {
						"properties": {
							"config": {
								"$ref": "#/$defs/redisStreamsPublish"
							}
						}
					}
				}
			]
		}
	}
}
